{
  "almaRedemptorisMater": {
    "name": "Alma Redemptoris Mater",
    "english": "Mother of Christ, hear thou thy people's cry, Star of the deep and Portal of the sky! Mother of Him who thee from nothing made. Sinking we strive and call to thee for aid: O, by what joy which Gabriel brought to thee, Thou Virgin first and last, let us thy mercy see.",
    "verified": false
  },
  "aveReginaCaelorum": {
    "name": "Ave Regina Caelorum",
    "english": "Hail, O Queen of heaven, enthroned! Hail, by Angels Mistress owned! Root of Jesse, Gate of morn, Whence the world's true Light was born: Glorious Virgin, joy to thee, Loveliest whom in heaven they see: Fairest thou, where all are fair, Plead with Christ our sins to spare.",
    "verified": false
  },
  "reginaCaeli": {
    "name": "Regina Caeli",
    "english": "O Queen of heaven rejoice! alleluia: For He whom thou didst merit to bear, alleluia, Hath arisen as he said, alleluia. Pray for us to God, alleluia.",
    "verified": false
  },
  "salveRegina": {
    "name": "Salve Regina",
    "english": "Hail holy Queen, Mother of Mercy, our life, our sweetness, and our hope. To thee do we cry, poor banished children of Eve. To thee do we send up our sighs, mourning and weeping in this valley of tears. Turn then, most gracious Advocate, thine eyes of mercy toward us. And after this our exile show unto us the blessed fruit of thy womb, Jesus. O clement, O loving, O sweet Virgin Mary.",
    "verified": false
  }
}
